<?xml version="1.0" encoding="UTF-8"?>
<circuito xmlns="http://www.uniovi.es"
	xmlns:xsi="http://www.w3.org/2001/XMLSchema-instance"
	xsi:schemaLocation="http://www.uniovi.es circuito.xsd">

    <nombre>Petronas Sepang International Circuit</nombre>
    <longitud unidad="metros">5543</longitud>
    <anchuraMedia unidad="metros">19</anchuraMedia>
    <fecha>2025-10-26</fecha>
    <hora>12:40:00</hora>
    <numeroVueltas>20</numeroVueltas>
    <localidadMasProxima>Kuala Lumpur</localidadMasProxima>
    <pais>Malasia</pais>
    <nombrePatrocinador>Petronas</nombrePatrocinador>
    <referencias>
        <referencia texto = "Página oficial del circuito" >https://www.sepangcircuit.com/</referencia>
        <referencia texto = "Información sobre el Gran Premio en la página oficial de MotoGP">https://www.motogp.com/es/calendar/2025/event/malaysia/c2cd8f49-5643-440f-84fc-4c37b3ef3f87?tab=overview</referencia>
        <referencia texto = "Información sobre el circuito">https://ssrexperience.com/es/servicios/sepang/</referencia>
    </referencias>
    <fotos>
        <foto descripcion = "Trazado del circuito">../multimedia/trazadoCircuito.jpg</foto>
        <foto descripcion = "Panorámica del circuito">../multimedia/panoramicaCircuito.jpg</foto>
        <foto descripcion = "Recta de salida del circuito">../multimedia/rectaSalida.jpg</foto>
    </fotos>
    <videos>
        <video descripcion = "Piloto corriendo en el circuito">../multimedia/videoRecorridoCircuito.mp4</video>
    </videos>
    <puntoOrigen>
        <coordenada>
            <longitudPunto unidad="decimal">101.738375</longitudPunto>
            <latitudPunto unidad="decimal">2.760762</latitudPunto>
            <altitudPunto unidad="metros">36</altitudPunto>
        </coordenada>         
    </puntoOrigen>

    <tramos>
        <tramo>
            <distancia unidad="metros">620.7</distancia>
            <coordenada>
                <longitudPunto unidad="decimal">101.732807</longitudPunto>
                <latitudPunto unidad="decimal">2.760338</latitudPunto>
                <altitudPunto unidad="metros">38</altitudPunto>
            </coordenada>           
            <sector>1</sector>
        </tramo>

        <tramo>
            <distancia unidad="metros">46.63</distancia>
            <coordenada>
                <longitudPunto unidad="decimal">101.732609</longitudPunto>
                <latitudPunto unidad="decimal">2.760710</latitudPunto>
                <altitudPunto unidad="metros">37</altitudPunto>
            </coordenada>           
            <sector>1</sector>
        </tramo>

        <tramo>
            <distancia unidad="metros">40.59</distancia>
            <coordenada>
                <longitudPunto unidad="decimal">101.732866</longitudPunto>
                <latitudPunto unidad="decimal">2.760966</latitudPunto>
                <altitudPunto unidad="metros">37</altitudPunto>
            </coordenada>           
            <sector>1</sector>
        </tramo>

        <tramo>
            <distancia unidad="metros">65.53</distancia>
            <coordenada>
                <longitudPunto unidad="decimal">101.733444</longitudPunto>
                <latitudPunto unidad="decimal">2.760841</latitudPunto>
                <altitudPunto unidad="metros">36</altitudPunto>
            </coordenada>
            <sector>1</sector>
        </tramo>

        <tramo>
            <distancia unidad="metros">39.74</distancia>
            <coordenada>
                <longitudPunto unidad="decimal">101.733570</longitudPunto>
                <latitudPunto unidad="decimal">2.761177</latitudPunto>
                <altitudPunto unidad="metros">34</altitudPunto>
            </coordenada>
            <sector>1</sector>
        </tramo>

        <tramo>
            <distancia unidad="metros">100.81</distancia>
            <coordenada>
                <longitudPunto unidad="decimal">101.733091</longitudPunto>
                <latitudPunto unidad="decimal">2.761952</latitudPunto>
                <altitudPunto unidad="metros">29</altitudPunto>
            </coordenada>
            <sector>1</sector>
        </tramo>

        <tramo>
            <distancia unidad="metros">121.88</distancia>
            <coordenada>
                <longitudPunto unidad="decimal">101.733196</longitudPunto>
                <latitudPunto unidad="decimal">2.763050</latitudPunto>
                <altitudPunto unidad="metros">24</altitudPunto>                  
            </coordenada>
            <sector>1</sector>
        </tramo>

        <tramo>
            <distancia unidad="metros">98.89</distancia>
            <coordenada>
                <longitudPunto unidad="decimal">101.733738</longitudPunto>
                <latitudPunto unidad="decimal">2.763754</latitudPunto>
                <altitudPunto unidad="metros">23</altitudPunto>
            </coordenada>            
            <sector>1</sector>
        </tramo>
            
        <tramo>
            <distancia unidad="metros">32.53</distancia>
            <coordenada>
                <longitudPunto unidad="decimal">101.734008</longitudPunto>
                <latitudPunto unidad="decimal">2.763870</latitudPunto>
                <altitudPunto unidad="metros">23</altitudPunto>
            </coordenada>            
            <sector>1</sector>
        </tramo>

        <tramo>
            <distancia unidad="metros">184.56</distancia>
            <coordenada>
                <longitudPunto unidad="decimal">101.735582</longitudPunto>
                <latitudPunto unidad="decimal">2.764404</latitudPunto>
                <altitudPunto unidad="metros">27</altitudPunto>
            </coordenada>
            <sector>2</sector>
        </tramo>

        <tramo>
            <distancia unidad="metros">212.71</distancia>
            <coordenada>
                <longitudPunto unidad="decimal">101.737341</longitudPunto>
                <latitudPunto unidad="decimal">2.765158</latitudPunto>
                <altitudPunto unidad="metros">36</altitudPunto>
            </coordenada>
            <sector>2</sector>
        </tramo>

        <tramo>
            <distancia unidad="metros">25.02</distancia>
            <coordenada>
                <longitudPunto unidad="decimal">101.737566</longitudPunto>
                <latitudPunto unidad="decimal">2.765152</latitudPunto>
                <altitudPunto unidad="metros">37</altitudPunto>
            </coordenada>
            <sector>2</sector>
        </tramo>

        <tramo>
            <distancia unidad="metros">25.16</distancia>
            <coordenada>
                <longitudPunto unidad="decimal">101.737657</longitudPunto>
                <latitudPunto unidad="decimal">2.764944</latitudPunto>
                <altitudPunto unidad="metros">38</altitudPunto>
            </coordenada>
            <sector>2</sector>
        </tramo>

        <tramo>
            <distancia unidad="metros">250.7</distancia>
            <coordenada>
                <longitudPunto unidad="decimal">101.738150</longitudPunto>
                <latitudPunto unidad="decimal">2.762731</latitudPunto>
                <altitudPunto unidad="metros">39</altitudPunto>
            </coordenada>
            <sector>2</sector>
        </tramo>

        <tramo>
            <distancia unidad="metros">73.28</distancia>
            <coordenada>
                <longitudPunto unidad="decimal">101.738644</longitudPunto>
                <latitudPunto unidad="decimal">2.762292</latitudPunto>
                <altitudPunto unidad="metros">37</altitudPunto>
            </coordenada>
            <sector>2</sector>
        </tramo>

        <tramo>
            <distancia unidad="metros">67.09</distancia>
            <coordenada>
                <longitudPunto unidad="decimal">101.739242</longitudPunto>
                <latitudPunto unidad="decimal">2.762226</latitudPunto>
                <altitudPunto unidad="metros">36</altitudPunto>
            </coordenada>
            <sector>2</sector>
        </tramo>

        <tramo>
            <distancia unidad="metros">65.11</distancia>
            <coordenada>
                <longitudPunto unidad="decimal">101.739771</longitudPunto>
                <latitudPunto unidad="decimal">2.762478</latitudPunto>
                <altitudPunto unidad="metros">37</altitudPunto>
            </coordenada>
            <sector>2</sector>
        </tramo>

        <tramo>
            <distancia unidad="metros">53.14</distancia>
            <coordenada>
                <longitudPunto unidad="decimal">101.740102</longitudPunto>
                <latitudPunto unidad="decimal">2.762824</latitudPunto>
                <altitudPunto unidad="metros">38</altitudPunto>
            </coordenada>
            <sector>2</sector>
        </tramo>

        <tramo>
            <distancia unidad="metros">48.71</distancia>
            <coordenada>
                <longitudPunto unidad="decimal">101.740508</longitudPunto>
                <latitudPunto unidad="decimal">2.762989</latitudPunto>
                <altitudPunto unidad="metros">39</altitudPunto>
            </coordenada>
            <sector>2</sector>
        </tramo>

        <tramo>
            <distancia unidad="metros">73.8</distancia>
            <coordenada>
                <longitudPunto unidad="decimal">101.741154</longitudPunto>
                <latitudPunto unidad="decimal">2.762837</latitudPunto>
                <altitudPunto unidad="metros">39</altitudPunto>
            </coordenada>
            <sector>2</sector>
        </tramo>

        <tramo>
            <distancia unidad="metros">215.04</distancia>
            <coordenada>
                <longitudPunto unidad="decimal">101.742443</longitudPunto>